{
 "$schema": "./metin.schema.json",
 "id": "s-zilzal",
 "kuran": {
  "sure": 99,
  "ayetler": [
   1,
   8
  ]
 },
 "sureAdi": "الزِّلْزَالِ",
 "bolumler": [
  {
   "no": 1,
   "ar": "اِذَا زُلْزِلَتِ الْاَرْضُ زِلْزَالَهَاۙ",
   "sayfa": 599
  },
  {
   "no": 2,
   "ar": "وَاَخْرَجَتِ الْاَرْضُ اَثْقَالَهَاۙ",
   "sayfa": 599
  },
  {
   "no": 3,
   "ar": "وَقَالَ الْاِنْسَانُ مَا لَهَاۚ",
   "sayfa": 599
  },
  {
   "no": 4,
   "ar": "یَوْمَئِذٍ تُحَدِّثُ اَخْبَارَهَاۙ",
   "sayfa": 599
  },
  {
   "no": 5,
   "ar": "بِاَنَّ رَبَّكَ اَوْحٰى لَهَاؕ",
   "sayfa": 599
  },
  {
   "no": 6,
   "ar": "یَوْمَئِذٍ یَصْدُرُ النَّاسُ اَشْتَاتًا لِیُرَوْا اَعْمَالَهُمْؕ",
   "sayfa": 599
  },
  {
   "no": 7,
   "ar": "فَمَنْ یَعْمَلْ مِثْقَالَ ذَرَّةٍ خَیْرًا یَرَهُؕ",
   "sayfa": 599
  },
  {
   "no": 8,
   "ar": "وَمَنْ یَعْمَلْ مِثْقَالَ ذَرَّةٍ شَرًّا یَرَهُ",
   "sayfa": 599
  }
 ],
 "meal": {
  "tr": {
   "kaynak": "Diyanet İşleri Başkanlığı Meâli (kuran.diyanet.gov.tr)",
   "gruplar": [
    {
     "ayetler": [
      1,
      3
     ],
     "metin": "Yeryüzü kendine has bir sarsıntıya uğratıldığı, içindekileri dışarıya çıkarıp attığı ve insan, \"Ona ne oluyor?\" dediği zaman,"
    },
    {
     "ayetler": [
      4,
      4
     ],
     "metin": "İşte o gün, yer, kendi haberlerini anlatır."
    },
    {
     "ayetler": [
      5,
      5
     ],
     "metin": "Çünkü Rabbin ona (öyle) vahyetmiştir."
    },
    {
     "ayetler": [
      6,
      6
     ],
     "metin": "O gün insanlar amellerinin kendilerine gösterilmesi için bölük bölük kabirlerinden çıkacaklardır."
    },
    {
     "ayetler": [
      7,
      7
     ],
     "metin": "Artık kim zerre ağırlığınca bir hayır işlerse onun mükafatını görecektir."
    },
    {
     "ayetler": [
      8,
      8
     ],
     "metin": "Kim de zerre ağırlığınca bir kötülük işlerse onun cezasını görecektir."
    }
   ]
  },
  "en": {
   "kaynak": "The Holy Quran with English Translation (Diyanet İşleri Başkanlığı, kuran.diyanet.gov.tr)",
   "gruplar": [
    {
     "ayetler": [
      1,
      1
     ],
     "metin": "When the earth is shaken ˹in˺ its ultimate quaking,"
    },
    {
     "ayetler": [
      2,
      2
     ],
     "metin": "and when the earth throws out ˹all˺ its contents,"
    },
    {
     "ayetler": [
      3,
      3
     ],
     "metin": "and humanity cries, “What is wrong with it?”—"
    },
    {
     "ayetler": [
      4,
      4
     ],
     "metin": "on that Day the earth will recount everything,"
    },
    {
     "ayetler": [
      5,
      5
     ],
     "metin": "having been inspired by your Lord ˹to do so˺."
    },
    {
     "ayetler": [
      6,
      6
     ],
     "metin": "On that Day people will proceed in separate groups to be shown ˹the consequences of˺ their deeds."
    },
    {
     "ayetler": [
      7,
      7
     ],
     "metin": "So whoever does an atom’s weight of good will see it."
    },
    {
     "ayetler": [
      8,
      8
     ],
     "metin": "And whoever does an atom’s weight of evil will see it."
    }
   ]
  },
  "de": {
   "kaynak": "Der Heilige Koran – Deutsche Übersetzung (Diyanet İşleri Başkanlığı, kuran.diyanet.gov.tr)",
   "gruplar": [
    {
     "ayetler": [
      1,
      1
     ],
     "metin": "Wenn die Erde in ihrem Beben erbebt,"
    },
    {
     "ayetler": [
      2,
      2
     ],
     "metin": "und die Erde ihre Lasten herausgibt,"
    },
    {
     "ayetler": [
      3,
      3
     ],
     "metin": "und der Mensch sagt: „Was ist mit ihr?“"
    },
    {
     "ayetler": [
      4,
      4
     ],
     "metin": "An jenem Tage wird sie ihre Geschichten erzählen,"
    },
    {
     "ayetler": [
      5,
      5
     ],
     "metin": "weil dein Herr ihr eingegeben hat."
    },
    {
     "ayetler": [
      6,
      6
     ],
     "metin": "An jenem Tage werden die Menschen in Haufen hervorkommen, um ihre Werke zu sehen;"
    },
    {
     "ayetler": [
      7,
      7
     ],
     "metin": "und wer auch nur Gutes im Gewicht eines Stäubchens getan hat, wird es sehen."
    },
    {
     "ayetler": [
      8,
      8
     ],
     "metin": "Und wer Böses im Gewicht eines Stäubchens getan hat, wird es sehen."
    }
   ]
  },
  "nl": {
   "kaynak": "Diyanet İşleri Başkanlığı Türkçe meâlinden Flemenkçeye taslak çeviri (yayımlanmış bir Flemenkçe meâlden alınmamıştır; gözden geçirilecek)",
   "inceleme": true,
   "gruplar": [
    {
     "ayetler": [
      1,
      3
     ],
     "metin": "Wanneer de aarde door haar eigen beving wordt geschud, wanneer zij uitwerpt wat in haar is, en de mens zegt: “Wat is er met haar?”,"
    },
    {
     "ayetler": [
      4,
      4
     ],
     "metin": "Op die dag zal de aarde haar nieuws vertellen."
    },
    {
     "ayetler": [
      5,
      5
     ],
     "metin": "Want je Heer heeft haar dat (zo) ingegeven."
    },
    {
     "ayetler": [
      6,
      6
     ],
     "metin": "Op die dag zullen de mensen in groepen uit hun graven komen, opdat hun daden hun getoond worden."
    },
    {
     "ayetler": [
      7,
      7
     ],
     "metin": "Wie dan ook maar het gewicht van een stofje aan goed doet, zal de beloning ervan zien."
    },
    {
     "ayetler": [
      8,
      8
     ],
     "metin": "En wie het gewicht van een stofje aan kwaad doet, zal de straf ervan zien."
    }
   ]
  },
  "fr": {
   "kaynak": "Muhammad Hamidullah, traduction française du sens (texte : Tanzil, fr.hamidullah)",
   "gruplar": [
    {
     "ayetler": [
      1,
      1
     ],
     "metin": "Quand la terre tremblera d'un violent tremblement,"
    },
    {
     "ayetler": [
      2,
      2
     ],
     "metin": "et que la terre fera sortir ses fardeaux,"
    },
    {
     "ayetler": [
      3,
      3
     ],
     "metin": "et que l'homme dira: «Qu'a-t-elle?»"
    },
    {
     "ayetler": [
      4,
      4
     ],
     "metin": "ce jour-là, elle contera son histoire,"
    },
    {
     "ayetler": [
      5,
      5
     ],
     "metin": "selon ce que ton Seigneur lui aura révélé [ordonné]."
    },
    {
     "ayetler": [
      6,
      6
     ],
     "metin": "Ce jour-là, les gens sortiront séparément pour que leur soient montrées leurs œuvres."
    },
    {
     "ayetler": [
      7,
      7
     ],
     "metin": "Quiconque fait un bien fût-ce du poids d'un atome, le verra,"
    },
    {
     "ayetler": [
      8,
      8
     ],
     "metin": "et quiconque fait un mal fût-ce du poids d'un atome, le verra."
    }
   ]
  }
 },
 "kaynak": {
  "ar": "Diyanet İşleri Başkanlığı, Kur'an-ı Kerim (kuran.diyanet.gov.tr, «Amasya Abay» metni)",
  "url": "https://kuran.diyanet.gov.tr",
  "alindi": "2026-10-24"
 },
 "ozet": "5cae97ca0d032fec0919b136f39de8902753f60fc286ed2d1decfc3dd1936c15",
 "zor": [],
 "onay": null
}
