{
 "$schema": "./metin.schema.json",
 "id": "s-bakara-285-286",
 "kuran": {
  "sure": 2,
  "ayetler": [
   285,
   286
  ]
 },
 "sureAdi": "الْبَقَرَةِ",
 "bolumler": [
  {
   "no": 285,
   "ar": "اٰمَنَ الرَّسُولُ بِمَٓا اُنْزِلَ اِلَیْهِ مِنْ رَبِّهٖ وَالْمُؤْمِنُونَؕ كُلٌّ اٰمَنَ بِاللّٰهِ وَمَلٰٓئِكَتِهٖ وَكُتُبِهٖ وَرُسُلِهٖؕ لَا نُفَرِّقُ بَیْنَ اَحَدٍ مِنْ رُسُلِهٖࣞ وَقَالُوا سَمِعْنَا وَاَطَعْنَا غُفْرَانَكَ رَبَّنَا وَاِلَیْكَ الْمَصٖیرُ",
   "sayfa": 48
  },
  {
   "no": 286,
   "ar": "لَا یُكَلِّفُ اللّٰهُ نَفْسًا اِلَّا وُسْعَهَاؕ لَهَا مَا كَسَبَتْ وَعَلَیْهَا مَا اكْتَسَبَتْؕ رَبَّنَا لَا تُؤَاخِذْنَٓا اِنْ نَسٖینَٓا اَوْ اَخْطَاْنَاۚ رَبَّنَا وَلَا تَحْمِلْ عَلَیْنَٓا اِصْرًا كَمَا حَمَلْتَهُ عَلَى الَّذٖینَ مِنْ قَبْلِنَاۚ رَبَّنَا وَلَا تُحَمِّلْنَا مَا لَا طَاقَةَ لَنَا بِهٖۚ وَاعْفُ عَنَّاࣞ وَاغْفِرْ لَنَاࣞ وَارْحَمْنَاࣞ اَنْتَ مَوْلٰینَا فَانْصُرْنَا عَلَى الْقَوْمِ الْكَافِرٖینَ",
   "sayfa": 48
  }
 ],
 "meal": {
  "tr": {
   "kaynak": "Diyanet İşleri Başkanlığı Meâli (kuran.diyanet.gov.tr)",
   "gruplar": [
    {
     "ayetler": [
      285,
      285
     ],
     "metin": "Peygamber, Rabbinden kendisine indirilene iman etti, mü'minler de (iman ettiler). Her biri; Allah'a, meleklerine, kitaplarına ve peygamberlerine iman ettiler ve şöyle dediler: \"Onun peygamberlerinden hiçbirini (diğerinden) ayırt etmeyiz.\" Şöyle de dediler: \"İşittik ve itaat ettik. Ey Rabbimiz! Senden bağışlama dileriz. Sonunda dönüş yalnız sanadır.\""
    },
    {
     "ayetler": [
      286,
      286
     ],
     "metin": "Allah bir kimseyi ancak gücünün yettiği şeyle yükümlü kılar. Onun kazandığı iyilik kendi yararına, kötülük de kendi zararınadır. (Şöyle diyerek dua ediniz): \"Ey Rabbimiz! Unutur, ya da yanılırsak bizi sorumlu tutma! Ey Rabbimiz! Bize, bizden öncekilere yüklediğin gibi ağır yük yükleme. Ey Rabbimiz! Bize gücümüzün yetmediği şeyleri yükleme! Bizi affet, bizi bağışla, bize acı! Sen bizim Mevlâmızsın. Kâfirler topluluğuna karşı bize yardım et.\""
    }
   ]
  },
  "en": {
   "kaynak": "The Holy Quran with English Translation (Diyanet İşleri Başkanlığı, kuran.diyanet.gov.tr)",
   "gruplar": [
    {
     "ayetler": [
      285,
      285
     ],
     "metin": "The Messenger ˹firmly˺ believes in what has been revealed to him from his Lord, and so do the believers. They ˹all˺ believe in Allah, His angels, His Books, and His messengers. ˹They proclaim,˺ “We make no distinction between any of His messengers.” And they say, “We hear and obey. ˹We seek˺ Your forgiveness, our Lord! And to You ˹alone˺ is the final return.”"
    },
    {
     "ayetler": [
      286,
      286
     ],
     "metin": "Allah does not require of any soul more than what it can afford. All good will be for its own benefit, and all evil will be to its own loss. ˹The believers pray,˺ “Our Lord! Do not punish us if we forget or make a mistake. Our Lord! Do not place a burden on us like the one you placed on those before us. Our Lord! Do not burden us with what we cannot bear. Pardon us, forgive us, and have mercy on us. You are our ˹only˺ Guardian. So grant us victory over the disbelieving people.”"
    }
   ]
  },
  "de": {
   "kaynak": "Der Heilige Koran – Deutsche Übersetzung (Diyanet İşleri Başkanlığı, kuran.diyanet.gov.tr)",
   "gruplar": [
    {
     "ayetler": [
      285,
      285
     ],
     "metin": "Der Gesandte glaubt an das, was von seinem Herrn zu ihm herabgesandt wurde. Und die Gläubigen glauben alle an Allah und seine Engel und seine Schriften und seine Gesandten. Wir machen keinen Unterschied zwischen seinen Gesandten. Und sie sprechen: „Wir hören und wir gehorchen. Unser Herr, schenke uns deine Vergebung! Und zu dir ist die Heimkehr!“"
    },
    {
     "ayetler": [
      286,
      286
     ],
     "metin": "Allah belastet keine Seele über Vermögen. Ihr gehört, was sie verdient, und auf sie kommt nach Verdienst. Unser Herr, belange uns nicht für Vergesslichkeit oder Fehler! Unser Herr, lege uns nicht auf eine Last, wie du sie den Früheren auferlegt hast! Unser Herr, lass uns nicht tragen, wozu unsere Kraft nicht ausreicht. Und vergib uns und verzeih uns und erbarme dich unser! Du bist unser Beschützer. Und hilf uns gegen das ungläubige Volk!"
    }
   ]
  }
 },
 "kaynak": {
  "ar": "Diyanet İşleri Başkanlığı, Kur'an-ı Kerim (kuran.diyanet.gov.tr, «Amasya Abay» metni)",
  "url": "https://kuran.diyanet.gov.tr",
  "alindi": "2026-10-19"
 },
 "ozet": "de34ea497523d6873c25107d827b3a82f5a819193b5196e4bcf3cde8cb54d77c",
 "zor": [],
 "onay": null
}
