{
 "$schema": "./metin.schema.json",
 "id": "d-kelime-i-tevhid",
 "bolumler": [
  {
   "no": 1,
   "ar": "لَآ اِلٰهَ اِلَّا اللّٰهُ"
  },
  {
   "no": 2,
   "ar": "مُحَمَّدٌ رَسُولُ اللّٰهِ"
  }
 ],
 "meal": {
  "tr": {
   "kaynak": "Diyanet İşleri Başkanlığı, Temel Dinî Bilgiler (S. Yazıcı, DİB Yay. 301), s. 25, «Kelime-i Tevhid»; okunuş: Diyanet İşleri Başkanlığı, Temel Dinî Bilgiler (S. Yazıcı, DİB Yay. 301), s. 25",
   "gruplar": [
    {
     "ayetler": [
      1,
      1
     ],
     "metin": "Allah’tan başka tanrı yoktur."
    },
    {
     "ayetler": [
      2,
      2
     ],
     "metin": "Hazreti Muhammed (s.a.s.) Allah’ın Peygamberidir."
    }
   ]
  },
  "fr": {
   "kaynak": "Diyanet İşleri Türk İslam Birliği (DİTİB), Camiye Gidiyorum 1 – Je vais à la mosquée 1 (resmî Fransızca yayın), s. 15",
   "gruplar": [
    {
     "ayetler": [
      1,
      1
     ],
     "metin": "Il n'y a de divinité qu'Allah."
    },
    {
     "ayetler": [
      2,
      2
     ],
     "metin": "Muhammed est le Messager d'Allah."
    }
   ]
  }
 },
 "kaynak": {
  "ar": "Diyanet İşleri Başkanlığı, Temel Dinî Bilgiler (S. Yazıcı, DİB Yay. 301), s. 25, «Kelime-i Tevhid» ↔ Diyanet İşleri Türk İslam Birliği (DİTİB), Camiye Gidiyorum 2, s. 6 ↔ Diyanet İşleri Başkanlığı, İslam İlmihali, IV. İman, «Kelime-i Tevhid»",
  "url": "https://diniyayinlar.diyanet.gov.tr/",
  "alindi": "2026-10-24"
 },
 "ozet": "1530ee01180909b4a120e226b3c85cefdd38849c5731ee7b8c69f2a69cc3dbd5",
 "okunus": {
  "tr": [
   {
    "no": 1,
    "metin": "Lâ ilâhe İllallâh,"
   },
   {
    "no": 2,
    "metin": "Muhammedün Resûlüllah."
   }
  ]
 },
 "zor": [],
 "onay": null
}
