{
 "$schema": "./metin.schema.json",
 "id": "d-kelime-i-sehadet",
 "bolumler": [
  {
   "no": 1,
   "ar": "اَشْهَدُ اَنْ لَآ اِلٰهَ اِلَّا اللّٰهُ"
  },
  {
   "no": 2,
   "ar": "وَاَشْهَدُ اَنَّ مُحَمَّدًا عَبْدُهُ وَرَسُولُهُ"
  }
 ],
 "meal": {
  "tr": {
   "kaynak": "Diyanet İşleri Başkanlığı, Temel Dinî Bilgiler (S. Yazıcı, DİB Yay. 301), s. 26, «Kelime-i Şehadet»; okunuş: Diyanet İşleri Başkanlığı, Temel Dinî Bilgiler (S. Yazıcı, DİB Yay. 301), s. 25",
   "gruplar": [
    {
     "ayetler": [
      1,
      1
     ],
     "metin": "Ben şahitlik ederim ki Allah’tan başka Tanrı yoktur."
    },
    {
     "ayetler": [
      2,
      2
     ],
     "metin": "Yine şahitlik ederim ki Hazreti Muhammed (s.a.s.) Allah’ın kulu ve Peygamberidir."
    }
   ]
  },
  "fr": {
   "kaynak": "Diyanet İşleri Türk İslam Birliği (DİTİB), Camiye Gidiyorum 1 – Je vais à la mosquée 1 (resmî Fransızca yayın), s. 18",
   "gruplar": [
    {
     "ayetler": [
      1,
      1
     ],
     "metin": "J'atteste qu'il n'est point de divinité hormis Allah"
    },
    {
     "ayetler": [
      2,
      2
     ],
     "metin": "et je témoigne que Muhammed est Son serviteur et Son Messager."
    }
   ]
  }
 },
 "kaynak": {
  "ar": "Diyanet İşleri Başkanlığı, Temel Dinî Bilgiler (S. Yazıcı, DİB Yay. 301), s. 25, «Kelime-i Şehadet» ↔ Diyanet İşleri Türk İslam Birliği (DİTİB), Camiye Gidiyorum 2, s. 6 ↔ Diyanet İşleri Başkanlığı, Tecvidli Kur’an-ı Kerim Elif-Bâ (2020), s. 39, «Âmentü Duâsı»",
  "url": "https://diniyayinlar.diyanet.gov.tr/",
  "alindi": "2026-10-24"
 },
 "ozet": "76356a3c3ae87d205e5a4b384561527d05c24499110cd6413badb4a3fd837d21",
 "okunus": {
  "tr": [
   {
    "no": 1,
    "metin": "Eşhedu en lâ ilâhe illallâh"
   },
   {
    "no": 2,
    "metin": "ve eşhedü enne Muhammeden abdühü ve Resûlüh."
   }
  ]
 },
 "zor": [],
 "onay": null
}
